{
  "formatVersion": 1,
  "id": "studynotch",
  "name": "StudyNotch",
  "bundleIdentifier": "dev.notchdeck.StudyNotch",
  "defaultKitID": "medicine",
  "infoPlist": {
    "NSAppleEventsUsageDescription": "StudyNotch controls Spotify and Music playback while you study and shows what's playing.",
    "NSCalendarsFullAccessUsageDescription": "StudyNotch shows your classes and exams today, and adds the study blocks you accept in Plan my day to your default calendar."
  }
}
