{
  "formatVersion": 1,
  "id": "appstore",
  "name": "Tabbi",
  "bundleIdentifier": "dev.tabbi.Tabbi",
  "defaultKitID": "essentials",
  "distribution": "appStore",
  "excludedModules": ["claudeUsage", "party"],
  "infoPlist": {
    "LSApplicationCategoryType": "public.app-category.productivity"
  }
}
